{
  "project": "spring-hexagonal-payments",
  "metric": "p99_latency_ms",
  "value": 120.869,
  "unit": "milliseconds",
  "timestamp": "2026-07-30T20:58:23.579Z",
  "command": "docker run --rm spring-hexagonal-payments",
  "repeat": 3,
  "summary": {
    "p99_latency_ms": 120.869,
    "throughput_rps": 645.7,
    "measured_requests": 6457,
    "warmup_requests": 200,
    "coverage_percent": 95.65,
    "checks_rate": 1,
    "http_failure_rate": 0
  },
  "environment": {
    "java": "25",
    "kotlin": "2.4.10",
    "spring_boot": "4.1.0",
    "postgresql": "18.4",
    "load_tool": "k6-2.1.0"
  }
}
